number,values_0,values_1,datetime_start,datetime_complete,duration,params_feature_strategy,params_max_input_features,params_minLeafPopulation,params_numberOfTrees,params_sampling_strategy,params_train_fraction,user_attrs_max_nodes,user_attrs_model_complexity,user_attrs_num_features,user_attrs_samples_per_year,system_attrs_NSGAIISampler:generation,state
0,0.870793371132885,581596444800.0,2026-10-05 00:40:40.930781,2026-10-05 00:44:04.190249,0 days 00:03:23.259468,uncorrelated,,2,50,reference_balanced,0.9,5341,581596444800.0,36,60496,0,COMPLETE
1,0.9670876293436615,1436719950000.0,2026-10-05 00:44:04.193879,2026-10-05 00:57:22.328554,0 days 00:13:18.134675,all,45.0,11,150,stratified,0.9,2525,1436719950000.0,45,84296,0,COMPLETE
2,0.8488805115969653,850343875200.0,2026-10-05 00:57:22.332153,2026-10-05 01:05:17.406079,0 days 00:07:55.073926,uncorrelated,,10,150,reference_balanced,0.9,2603,850343875200.0,36,60496,0,COMPLETE
3,0.9279124360684764,60615205200.0,2026-10-05 01:05:17.409764,2026-10-05 01:06:40.528004,0 days 00:01:23.118240,uncorrelated,,3,150,stratified,0.1,1199,60615205200.0,36,9362,0,COMPLETE
4,0.8495941046273902,239127193800.0,2026-10-05 01:06:40.531624,2026-10-05 01:11:10.610527,0 days 00:04:30.078903,all,22.0,12,150,reference_balanced,0.5,1661,239127193800.0,22,43626,0,COMPLETE
5,0.8651594043866248,1099964151000.0,2026-10-05 01:11:10.614289,2026-10-05 01:18:32.093178,0 days 00:07:21.478889,all,52.0,2,125,reference_balanced,0.5,3879,1099964151000.0,52,43626,0,COMPLETE
6,0.960706275355471,726066369000.0,2026-10-05 01:18:32.098023,2026-10-05 01:25:17.035679,0 days 00:06:44.937656,uncorrelated,,11,125,stratified,0.7000000000000001,2461,726066369000.0,36,65562,0,COMPLETE
7,0.9688854107463564,1126184698800.0,2026-10-05 01:25:17.038058,2026-10-05 01:34:15.442128,0 days 00:08:58.404070,uncorrelated,,7,150,stratified,0.7000000000000001,3181,1126184698800.0,36,65562,0,COMPLETE
8,0.8587710367056371,605245311000.0,2026-10-05 01:34:15.446669,2026-10-05 01:39:22.410685,0 days 00:05:06.964016,uncorrelated,,5,125,reference_balanced,0.5,3083,605245311000.0,36,43626,0,COMPLETE
9,0.9835424428603592,399573577000.0,2026-10-05 01:39:22.415657,2026-10-05 01:44:37.913250,0 days 00:05:15.497593,all,13.0,7,125,stratified,0.9,2917,399573577000.0,13,84296,0,COMPLETE
10,0.9336192396665506,122961912300.0,2026-10-05 01:44:37.915777,2026-10-05 01:46:38.172044,0 days 00:02:00.256267,all,69.0,2,150,stratified,0.1,1269,122961912300.0,69,9362,0,COMPLETE
11,0.9444166717509574,207467527500.0,2026-10-05 01:46:38.175491,2026-10-05 01:49:34.220924,0 days 00:02:56.045433,uncorrelated,,8,125,stratified,0.30000000000000004,1641,207467527500.0,36,28095,0,COMPLETE
12,0.9326966275102038,95048194500.0,2026-10-05 01:49:34.224499,2026-10-05 01:51:20.648736,0 days 00:01:46.424237,uncorrelated,,12,75,stratified,0.30000000000000004,1253,95048194500.0,36,28095,0,COMPLETE
13,0.9578274042859628,1561293468000.0,2026-10-05 01:51:20.651797,2026-10-05 02:03:47.676564,0 days 00:12:27.024767,all,72.0,11,150,stratified,0.7000000000000001,2205,1561293468000.0,72,65562,0,COMPLETE
14,0.8411343470239648,108232550775.0,2026-10-05 02:03:47.678845,2026-10-05 02:05:58.723806,0 days 00:02:11.044961,all,37.0,9,75,reference_balanced,0.30000000000000004,1399,108232550775.0,37,27879,0,COMPLETE
15,0.8013346903296958,27274932000.0,2026-10-05 02:05:58.726171,2026-10-05 02:07:07.594351,0 days 00:01:08.868180,uncorrelated,,10,125,reference_balanced,0.1,647,27274932000.0,36,9368,0,COMPLETE
16,0.83624453566072,632646995400.0,2026-10-05 02:07:07.597666,2026-10-05 02:13:24.931714,0 days 00:06:17.334048,all,84.0,7,150,reference_balanced,0.30000000000000004,1801,632646995400.0,84,27879,0,COMPLETE
17,0.8540119119114962,122695479000.0,2026-10-05 02:13:24.934903,2026-10-05 02:14:51.769324,0 days 00:01:26.834421,uncorrelated,,4,50,reference_balanced,0.30000000000000004,2445,122695479000.0,36,27879,0,COMPLETE
18,0.8476240077438262,432259567200.0,2026-10-05 02:14:51.772209,2026-10-05 02:19:30.123526,0 days 00:04:38.351317,uncorrelated,,11,100,reference_balanced,0.7000000000000001,2283,432259567200.0,36,52594,0,COMPLETE
19,0.8509541351645257,397767249600.0,2026-10-05 02:19:30.126135,2026-10-05 02:25:12.017644,0 days 00:05:41.891509,all,31.0,12,100,reference_balanced,0.9,2121,397767249600.0,31,60496,0,COMPLETE
20,0.9756922433690018,645075140000.0,2026-10-05 02:25:12.020937,2026-10-05 02:30:20.158655,0 days 00:05:08.137718,all,50.0,7,50,stratified,0.9,3061,645075140000.0,50,84296,0,COMPLETE
21,0.8207768880220108,51447182400.0,2026-10-05 02:30:20.161389,2026-10-05 02:31:45.531986,0 days 00:01:25.370597,uncorrelated,,5,150,reference_balanced,0.1,1017,51447182400.0,36,9368,0,COMPLETE
22,0.8528202309521415,504722665200.0,2026-10-05 02:31:45.534438,2026-10-05 02:36:37.438228,0 days 00:04:51.903790,all,43.0,8,75,reference_balanced,0.9,2587,504722665200.0,43,60496,0,COMPLETE
23,0.8109895445629877,54473983200.0,2026-10-05 02:36:37.443876,2026-10-05 02:37:50.082320,0 days 00:01:12.638444,all,84.0,5,75,reference_balanced,0.1,923,54473983200.0,84,9368,0,COMPLETE
24,0.945451266322918,87588972000.0,2026-10-05 02:37:50.085186,2026-10-05 02:39:37.519578,0 days 00:01:47.434392,all,32.0,9,75,stratified,0.30000000000000004,1299,87588972000.0,32,28095,0,COMPLETE
25,0.8649851227671319,200521455750.0,2026-10-05 02:39:37.522889,2026-10-05 02:43:31.548770,0 days 00:03:54.025881,all,17.0,6,125,reference_balanced,0.5,2163,200521455750.0,17,43626,0,COMPLETE
26,0.8483774247559626,1431478125000.0,2026-10-05 02:43:31.551417,2026-10-05 02:52:29.275478,0 days 00:08:57.724061,all,84.0,4,125,reference_balanced,0.5,3125,1431478125000.0,84,43626,0,COMPLETE
27,0.8202575100798215,42872652000.0,2026-10-05 02:52:29.278782,2026-10-05 02:53:42.648217,0 days 00:01:13.369435,uncorrelated,,5,125,reference_balanced,0.1,1017,42872652000.0,36,9368,0,COMPLETE
28,0.8568984830887147,748596699000.0,2026-10-05 02:53:42.651969,2026-10-05 02:59:43.919911,0 days 00:06:01.267942,uncorrelated,,6,125,reference_balanced,0.7000000000000001,3163,748596699000.0,36,52594,0,COMPLETE
29,0.8207768880220108,51447182400.0,2026-10-05 02:59:43.923150,2026-10-05 03:01:07.988249,0 days 00:01:24.065099,uncorrelated,,5,150,reference_balanced,0.1,1017,51447182400.0,36,9368,0,COMPLETE
30,0.964304729986541,625667253750.0,2026-10-05 03:01:07.990885,2026-10-05 03:05:53.203650,0 days 00:04:45.212765,all,70.0,5,75,stratified,0.5,2545,625667253750.0,70,46827,0,COMPLETE
31,0.9622288219477801,464316640200.0,2026-10-05 03:05:53.208139,2026-10-05 03:10:03.133043,0 days 00:04:09.924904,uncorrelated,,10,75,stratified,0.7000000000000001,2623,464316640200.0,36,65562,0,COMPLETE
32,0.8522579726106101,79591060125.0,2026-10-05 03:10:03.135870,2026-10-05 03:11:37.440829,0 days 00:01:34.304959,all,23.0,7,75,reference_balanced,0.30000000000000004,1655,79591060125.0,23,27879,0,COMPLETE
33,0.9042352504204427,43711178000.0,2026-10-05 03:11:37.443840,2026-10-05 03:12:55.094252,0 days 00:01:17.650412,all,70.0,7,100,stratified,0.1,667,43711178000.0,70,9362,0,COMPLETE
34,0.797265665837366,10539000000.0,2026-10-05 03:12:55.097917,2026-10-05 03:13:30.001247,0 days 00:00:34.903330,uncorrelated,,11,50,reference_balanced,0.1,625,10539000000.0,36,9368,0,COMPLETE
35,0.9715688498642769,530913067200.0,2026-10-05 03:13:30.005226,2026-10-05 03:17:14.798962,0 days 00:03:44.793736,uncorrelated,,8,50,stratified,0.9,3499,530913067200.0,36,84296,0,COMPLETE
36,0.8400527238303035,339791426100.0,2026-10-05 03:17:14.802828,2026-10-05 03:20:32.073995,0 days 00:03:17.271167,all,63.0,11,50,reference_balanced,0.7000000000000001,2051,339791426100.0,63,52594,0,COMPLETE
37,0.9666799703800055,1152031284000.0,2026-10-05 03:20:32.077260,2026-10-05 03:29:17.666352,0 days 00:08:45.589092,uncorrelated,,11,125,stratified,0.9,3037,1152031284000.0,36,84296,0,COMPLETE
38,0.9671476329225417,2374444982250.0,2026-10-05 03:29:17.669211,2026-10-05 03:40:00.906098,0 days 00:10:43.236887,all,97.0,3,150,stratified,0.5,3485,2374444982250.0,97,46827,0,COMPLETE
39,0.947776065839464,794068852500.0,2026-10-05 03:40:00.909314,2026-10-05 03:48:40.883553,0 days 00:08:39.974239,all,70.0,12,150,stratified,0.5,1615,794068852500.0,70,46827,0,COMPLETE
