number,values_0,values_1,datetime_start,datetime_complete,duration,params_feature_strategy,params_max_input_features,params_minLeafPopulation,params_numberOfTrees,params_sampling_strategy,params_train_fraction,user_attrs_max_nodes,user_attrs_model_complexity,user_attrs_num_features,user_attrs_samples_per_year,system_attrs_NSGAIISampler:generation,state
0,0.914687717012382,3257040600.0,2026-10-05 20:55:45.625853,2026-10-05 20:55:53.333975,0 days 00:00:07.708122,uncorrelated,,10,100,stratified,0.1,271,3257040600.0,33,3642,0,COMPLETE
1,0.9015600407731322,6767768700.0,2026-10-05 20:55:53.335743,2026-10-05 20:56:03.397702,0 days 00:00:10.061959,all,81.0,10,100,reference_balanced,0.1,231,6767768700.0,81,3617,0,COMPLETE
2,0.9687927675463841,71594458650.0,2026-10-05 20:56:03.398954,2026-10-05 20:56:36.025354,0 days 00:00:32.626400,uncorrelated,,12,150,stratified,0.5,793,71594458650.0,33,18239,0,COMPLETE
3,0.9484505669857941,51583194000.0,2026-10-05 20:56:36.026690,2026-10-05 20:57:03.949511,0 days 00:00:27.922821,all,62.0,11,150,stratified,0.30000000000000004,507,51583194000.0,62,10940,0,COMPLETE
4,0.9577922126421161,14795256000.0,2026-10-05 20:57:03.951193,2026-10-05 20:57:19.125148,0 days 00:00:15.173955,all,28.0,11,100,stratified,0.30000000000000004,483,14795256000.0,28,10940,0,COMPLETE
5,0.9575772434942135,48708111375.0,2026-10-05 20:57:19.126320,2026-10-05 20:57:46.684632,0 days 00:00:27.558312,uncorrelated,,12,125,reference_balanced,0.5,693,48708111375.0,33,17039,0,COMPLETE
6,0.9240836682159758,5675615550.0,2026-10-05 20:57:46.686437,2026-10-05 20:57:57.423741,0 days 00:00:10.737304,uncorrelated,,7,150,reference_balanced,0.1,317,5675615550.0,33,3617,0,COMPLETE
7,0.9425433562699125,47417242000.0,2026-10-05 20:57:57.424999,2026-10-05 20:58:20.507060,0 days 00:00:23.082061,all,89.0,12,100,stratified,0.30000000000000004,487,47417242000.0,89,10940,0,COMPLETE
8,0.9818262311877946,108763318125.0,2026-10-05 20:58:20.508637,2026-10-05 20:58:48.823904,0 days 00:00:28.315267,uncorrelated,,4,75,reference_balanced,0.9,1663,108763318125.0,33,26425,0,COMPLETE
9,0.9545717090011977,50390382600.0,2026-10-05 20:58:48.825055,2026-10-05 20:59:17.210138,0 days 00:00:28.385083,all,47.0,6,150,reference_balanced,0.30000000000000004,667,50390382600.0,47,10716,0,COMPLETE
10,0.9381866634382755,6520094625.0,2026-10-05 20:59:17.211501,2026-10-05 20:59:26.819722,0 days 00:00:09.608221,uncorrelated,,4,125,reference_balanced,0.1,437,6520094625.0,33,3617,0,COMPLETE
11,0.9796224981937462,79709958900.0,2026-10-05 20:59:26.820976,2026-10-05 20:59:51.156132,0 days 00:00:24.335156,uncorrelated,,4,75,reference_balanced,0.7000000000000001,1437,79709958900.0,33,22412,0,COMPLETE
12,0.9785406536980192,41509684125.0,2026-10-05 20:59:51.157797,2026-10-05 21:00:16.238195,0 days 00:00:25.080398,all,21.0,8,125,stratified,0.5,867,41509684125.0,21,18239,0,COMPLETE
13,0.95051066897921,72469629000.0,2026-10-05 21:00:16.239431,2026-10-05 21:00:50.687568,0 days 00:00:34.448137,all,71.0,7,150,reference_balanced,0.30000000000000004,635,72469629000.0,71,10716,0,COMPLETE
14,0.9871840750199417,123001804800.0,2026-10-05 21:00:50.688754,2026-10-05 21:01:25.648543,0 days 00:00:34.959789,all,32.0,5,75,stratified,0.9,1561,123001804800.0,32,32832,0,COMPLETE
15,0.9821423578563887,92578929300.0,2026-10-05 21:01:25.649807,2026-10-05 21:01:50.220374,0 days 00:00:24.570567,uncorrelated,,3,75,reference_balanced,0.7000000000000001,1669,92578929300.0,33,22412,0,COMPLETE
16,0.9891466574254468,24301187625.0,2026-10-05 21:01:50.221554,2026-10-05 21:02:09.789892,0 days 00:00:19.568338,all,11.0,4,125,stratified,0.5,969,24301187625.0,11,18239,0,COMPLETE
17,0.9215066371359872,3689710200.0,2026-10-05 21:02:09.792042,2026-10-05 21:02:17.512643,0 days 00:00:07.720601,uncorrelated,,8,100,stratified,0.1,307,3689710200.0,33,3642,0,COMPLETE
18,0.9879901577520807,333000201600.0,2026-10-05 21:02:17.514019,2026-10-05 21:03:21.421888,0 days 00:01:03.907869,uncorrelated,,4,150,stratified,0.9,2049,333000201600.0,33,32832,0,COMPLETE
19,0.9328327796088459,4452165300.0,2026-10-05 21:03:21.423084,2026-10-05 21:03:29.501915,0 days 00:00:08.078831,uncorrelated,,5,100,reference_balanced,0.1,373,4452165300.0,33,3617,0,COMPLETE
20,0.9697356045154157,77947143750.0,2026-10-05 21:03:29.503047,2026-10-05 21:04:13.659153,0 days 00:00:44.156106,all,23.0,12,150,reference_balanced,0.9,855,77947143750.0,23,26425,0,COMPLETE
21,0.9685205472276811,34599820800.0,2026-10-05 21:04:13.660334,2026-10-05 21:04:27.755766,0 days 00:00:14.095432,all,64.0,2,50,reference_balanced,0.30000000000000004,1009,34599820800.0,64,10716,0,COMPLETE
22,0.9143540596323875,1867728375.0,2026-10-05 21:04:27.757031,2026-10-05 21:04:34.820414,0 days 00:00:07.063383,all,27.0,8,75,reference_balanced,0.1,255,1867728375.0,27,3617,0,COMPLETE
23,0.944641870731165,3137024100.0,2026-10-05 21:04:34.821899,2026-10-05 21:04:44.522161,0 days 00:00:09.700262,all,14.0,3,150,reference_balanced,0.1,413,3137024100.0,14,3617,0,COMPLETE
24,0.968119384019094,43394499225.0,2026-10-05 21:04:44.523580,2026-10-05 21:05:03.105024,0 days 00:00:18.581444,uncorrelated,,6,75,reference_balanced,0.5,1029,43394499225.0,33,17039,0,COMPLETE
25,0.9606698536137278,35578521000.0,2026-10-05 21:05:03.106170,2026-10-05 21:05:23.939639,0 days 00:00:20.833469,uncorrelated,,9,150,stratified,0.30000000000000004,657,35578521000.0,33,10940,0,COMPLETE
26,0.9072363463801714,2757239100.0,2026-10-05 21:05:23.940901,2026-10-05 21:05:31.447535,0 days 00:00:07.506634,uncorrelated,,12,100,reference_balanced,0.1,231,2757239100.0,33,3617,0,COMPLETE
27,0.961075504620488,22305086100.0,2026-10-05 21:05:31.448752,2026-10-05 21:05:44.094704,0 days 00:00:12.645952,uncorrelated,,5,75,reference_balanced,0.30000000000000004,841,22305086100.0,33,10716,0,COMPLETE
28,0.9703541990001958,51108480500.0,2026-10-05 21:05:44.095934,2026-10-05 21:06:14.958574,0 days 00:00:30.862640,all,28.0,6,125,reference_balanced,0.5,857,51108480500.0,28,17039,0,COMPLETE
29,0.9040825587953145,9887973750.0,2026-10-05 21:06:14.959811,2026-10-05 21:06:28.102224,0 days 00:00:13.142413,all,75.0,9,150,reference_balanced,0.1,243,9887973750.0,75,3617,0,COMPLETE
30,0.9542616943708488,28959547500.0,2026-10-05 21:06:28.103624,2026-10-05 21:06:45.440792,0 days 00:00:17.337168,all,65.0,9,75,stratified,0.30000000000000004,543,28959547500.0,65,10940,0,COMPLETE
31,0.9874032742416985,21986172000.0,2026-10-05 21:06:45.442024,2026-10-05 21:07:05.618248,0 days 00:00:20.176224,all,10.0,5,100,reference_balanced,0.7000000000000001,981,21986172000.0,10,22412,0,COMPLETE
32,0.969320184896248,28917702000.0,2026-10-05 21:07:05.619564,2026-10-05 21:07:20.993503,0 days 00:00:15.373939,uncorrelated,,6,100,stratified,0.30000000000000004,801,28917702000.0,33,10940,0,COMPLETE
33,0.9806575114416938,95775268875.0,2026-10-05 21:07:20.994721,2026-10-05 21:07:50.802720,0 days 00:00:29.807999,uncorrelated,,5,125,stratified,0.5,1273,95775268875.0,33,18239,0,COMPLETE
34,0.9809796134456022,109856822625.0,2026-10-05 21:07:50.803949,2026-10-05 21:08:21.138138,0 days 00:00:30.334189,uncorrelated,,2,125,reference_balanced,0.5,1563,109856822625.0,33,17039,0,COMPLETE
35,0.9844495210470328,661564800000.0,2026-10-05 21:08:21.139182,2026-10-05 21:09:48.768910,0 days 00:01:27.629728,all,100.0,3,100,stratified,0.9,2015,661564800000.0,100,32832,0,COMPLETE
36,0.9735200160433771,118699447500.0,2026-10-05 21:09:48.770172,2026-10-05 21:10:17.795967,0 days 00:00:29.025795,all,90.0,9,50,stratified,0.7000000000000001,1033,118699447500.0,90,25535,0,COMPLETE
37,0.9578388925876504,27302137500.0,2026-10-05 21:10:17.797122,2026-10-05 21:10:35.444592,0 days 00:00:17.647470,uncorrelated,,10,125,stratified,0.30000000000000004,605,27302137500.0,33,10940,0,COMPLETE
38,0.9791295518518527,142450827750.0,2026-10-05 21:10:35.445905,2026-10-05 21:11:22.342255,0 days 00:00:46.896350,uncorrelated,,10,150,stratified,0.7000000000000001,1127,142450827750.0,33,25535,0,COMPLETE
39,0.9797328764723006,53139972600.0,2026-10-05 21:11:22.343617,2026-10-05 21:11:39.609666,0 days 00:00:17.266049,uncorrelated,,4,50,reference_balanced,0.7000000000000001,1437,53139972600.0,33,22412,0,COMPLETE
