number,values_0,values_1,datetime_start,datetime_complete,duration,params_feature_strategy,params_max_input_features,params_minLeafPopulation,params_numberOfTrees,params_sampling_strategy,params_train_fraction,user_attrs_max_nodes,user_attrs_model_complexity,user_attrs_num_features,user_attrs_samples_per_year,system_attrs_NSGAIISampler:generation,state
0,0.964591200757936,303197314900.0,2026-10-05 12:50:14.176562,2026-10-05 12:51:56.200595,0 days 00:01:42.024033,all,47.0,12,100,reference_balanced,0.7000000000000001,1553,303197314900.0,47,41539,0,COMPLETE
1,0.9780539768033844,56846121500.0,2026-10-05 12:51:56.201838,2026-10-05 12:52:23.997219,0 days 00:00:27.795381,all,14.0,7,50,reference_balanced,0.7000000000000001,1955,56846121500.0,14,41539,0,COMPLETE
2,0.9526343605418135,100864237500.0,2026-10-05 12:52:23.998390,2026-10-05 12:53:03.103739,0 days 00:00:39.105349,uncorrelated,,11,50,stratified,0.5,1455,100864237500.0,39,35550,0,COMPLETE
3,0.9723380979817129,116872402500.0,2026-10-05 12:53:03.105459,2026-10-05 12:53:45.789259,0 days 00:00:42.683800,all,31.0,4,50,stratified,0.5,2121,116872402500.0,31,35550,0,COMPLETE
4,0.9370860237088439,196991100900.0,2026-10-05 12:53:45.790633,2026-10-05 12:55:28.740891,0 days 00:01:42.950258,all,66.0,11,150,stratified,0.30000000000000004,933,196991100900.0,66,21327,0,COMPLETE
5,0.9674668057645929,570772764900.0,2026-10-05 12:55:28.742927,2026-10-05 12:57:42.468037,0 days 00:02:13.725110,uncorrelated,,11,100,stratified,0.9,2287,570772764900.0,39,63993,0,COMPLETE
6,0.9799475310288994,328652674350.0,2026-10-05 12:57:42.469659,2026-10-05 12:58:34.338458,0 days 00:00:51.868799,uncorrelated,,4,50,reference_balanced,0.9,3311,328652674350.0,39,50903,0,COMPLETE
7,0.8950439531370695,32844642600.0,2026-10-05 12:58:34.339768,2026-10-05 12:59:05.854704,0 days 00:00:31.514936,all,62.0,8,150,stratified,0.1,497,32844642600.0,62,7106,0,COMPLETE
8,0.9078514661947646,23791482000.0,2026-10-05 12:59:05.855766,2026-10-05 12:59:25.853040,0 days 00:00:19.997274,all,78.0,12,100,reference_balanced,0.1,429,23791482000.0,78,7110,0,COMPLETE
9,0.9415572928120828,41036787000.0,2026-10-05 12:59:25.854394,2026-10-05 12:59:43.223320,0 days 00:00:17.368926,all,106.0,2,50,reference_balanced,0.1,1089,41036787000.0,106,7110,0,COMPLETE
10,0.917729392289226,9491839500.0,2026-10-05 12:59:43.224652,2026-10-05 12:59:54.404071,0 days 00:00:11.179419,uncorrelated,,5,50,stratified,0.1,685,9491839500.0,39,7106,0,COMPLETE
11,0.9225846851738344,5266434250.0,2026-10-05 12:59:54.406044,2026-10-05 13:00:09.210505,0 days 00:00:14.804461,all,11.0,7,125,stratified,0.1,539,5266434250.0,11,7106,0,COMPLETE
12,0.9063824233871316,4092345400.0,2026-10-05 13:00:09.211751,2026-10-05 13:00:21.737299,0 days 00:00:12.525548,all,13.0,10,100,stratified,0.1,443,4092345400.0,13,7106,0,COMPLETE
13,0.911042514085914,12865945950.0,2026-10-05 13:00:21.739127,2026-10-05 13:00:35.551997,0 days 00:00:13.812870,uncorrelated,,6,75,stratified,0.1,619,12865945950.0,39,7106,0,COMPLETE
14,0.9652824476310875,130760618100.0,2026-10-05 13:00:35.553291,2026-10-05 13:01:26.384716,0 days 00:00:50.831425,all,42.0,12,50,reference_balanced,0.7000000000000001,1499,130760618100.0,42,41539,0,COMPLETE
15,0.96259772764465,252395447850.0,2026-10-05 13:01:26.387226,2026-10-05 13:02:30.929978,0 days 00:01:04.542752,uncorrelated,,3,150,stratified,0.30000000000000004,2023,252395447850.0,39,21327,0,COMPLETE
16,0.9626138831037561,899091362400.0,2026-10-05 13:02:30.931204,2026-10-05 13:06:35.567875,0 days 00:04:04.636671,all,68.0,11,150,stratified,0.7000000000000001,1771,899091362400.0,68,49772,0,COMPLETE
17,0.9699052744389616,298569870300.0,2026-10-05 13:06:35.569420,2026-10-05 13:07:52.504039,0 days 00:01:16.934619,uncorrelated,,10,100,reference_balanced,0.7000000000000001,1843,298569870300.0,39,41539,0,COMPLETE
18,0.958442674294218,73485377550.0,2026-10-05 13:07:52.505479,2026-10-05 13:08:16.802108,0 days 00:00:24.296629,uncorrelated,,4,50,stratified,0.30000000000000004,1767,73485377550.0,39,21327,0,COMPLETE
19,0.9163735655404301,3631166000.0,2026-10-05 13:08:16.805494,2026-10-05 13:08:26.271443,0 days 00:00:09.465949,all,20.0,7,50,stratified,0.1,511,3631166000.0,20,7106,0,COMPLETE
20,0.9546881631744835,237719088000.0,2026-10-05 13:08:26.273078,2026-10-05 13:09:50.049854,0 days 00:01:23.776776,all,96.0,8,100,reference_balanced,0.30000000000000004,1255,237719088000.0,96,19731,0,COMPLETE
21,0.9647900156300561,31729421100.0,2026-10-05 13:09:50.059254,2026-10-05 13:10:17.591049,0 days 00:00:27.531795,all,26.0,6,50,reference_balanced,0.30000000000000004,1237,31729421100.0,26,19731,0,COMPLETE
22,0.9494416525343807,43429904100.0,2026-10-05 13:10:17.593178,2026-10-05 13:10:45.474423,0 days 00:00:27.881245,all,46.0,11,50,reference_balanced,0.30000000000000004,957,43429904100.0,46,19731,0,COMPLETE
23,0.9183083555741417,10211204250.0,2026-10-05 13:10:45.475515,2026-10-05 13:10:59.850953,0 days 00:00:14.375438,uncorrelated,,11,75,reference_balanced,0.1,491,10211204250.0,39,7110,0,COMPLETE
24,0.9764055627731159,315726660000.0,2026-10-05 13:10:59.855898,2026-10-05 13:12:56.703040,0 days 00:01:56.847142,all,24.0,3,150,stratified,0.5,2467,315726660000.0,24,35550,0,COMPLETE
25,0.9692927642969172,154996074675.0,2026-10-05 13:12:56.704783,2026-10-05 13:13:49.313630,0 days 00:00:52.608847,uncorrelated,,8,75,reference_balanced,0.5,1699,154996074675.0,39,31189,0,COMPLETE
26,0.9692897410816956,885567130500.0,2026-10-05 13:13:49.315863,2026-10-05 15:03:51.153339,0 days 01:50:01.837476,all,52.0,10,125,stratified,0.9,2129,885567130500.0,52,63993,0,COMPLETE
27,0.9670302021694069,440437405200.0,2026-10-05 15:03:51.154659,2026-10-05 15:05:13.343184,0 days 00:01:22.188525,uncorrelated,,8,100,stratified,0.7000000000000001,2269,440437405200.0,39,49772,0,COMPLETE
28,0.9678115522822615,630153688500.0,2026-10-05 15:05:13.344508,2026-10-05 15:07:13.198985,0 days 00:01:59.854477,all,63.0,10,100,reference_balanced,0.9,1965,630153688500.0,63,50903,0,COMPLETE
29,0.9668594660194714,742556356375.0,2026-10-05 15:07:13.200199,2026-10-05 15:09:32.169214,0 days 00:02:18.969015,all,83.0,10,125,reference_balanced,0.7000000000000001,1723,742556356375.0,83,41539,0,COMPLETE
30,0.9792250987219124,161830817600.0,2026-10-05 15:09:32.170421,2026-10-05 15:10:32.711234,0 days 00:01:00.540813,all,16.0,8,100,reference_balanced,0.9,1987,161830817600.0,16,50903,0,COMPLETE
31,0.9726974871170261,248261321100.0,2026-10-05 15:10:32.712407,2026-10-05 15:11:19.583474,0 days 00:00:46.871067,uncorrelated,,6,100,reference_balanced,0.5,2041,248261321100.0,39,31189,0,COMPLETE
32,0.9710743557749453,506823298800.0,2026-10-05 15:11:19.584762,2026-10-05 15:12:38.358668,0 days 00:01:18.773906,uncorrelated,,6,100,stratified,0.7000000000000001,2611,506823298800.0,39,49772,0,COMPLETE
33,0.9566474032790468,374531811400.0,2026-10-05 15:12:38.360266,2026-10-05 15:13:49.817060,0 days 00:01:11.456794,all,89.0,12,50,stratified,0.7000000000000001,1691,374531811400.0,89,49772,0,COMPLETE
34,0.9451711914029004,13711990500.0,2026-10-05 15:13:49.818372,2026-10-05 15:13:58.864774,0 days 00:00:09.046402,uncorrelated,,3,50,reference_balanced,0.1,989,13711990500.0,39,7110,0,COMPLETE
35,0.9469362657999809,37399488750.0,2026-10-05 15:13:58.865932,2026-10-05 15:14:15.872677,0 days 00:00:17.006745,uncorrelated,,3,125,reference_balanced,0.1,1079,37399488750.0,39,7110,0,COMPLETE
36,0.9730273718424158,274957948200.0,2026-10-05 15:14:15.874178,2026-10-05 15:14:57.557654,0 days 00:00:41.683476,uncorrelated,,5,50,stratified,0.7000000000000001,2833,274957948200.0,39,49772,0,COMPLETE
37,0.9810311699194606,608682941100.0,2026-10-05 15:14:57.559081,2026-10-05 15:16:00.267428,0 days 00:01:02.708347,uncorrelated,,2,75,stratified,0.7000000000000001,4181,608682941100.0,39,49772,0,COMPLETE
38,0.9725416614695794,119986875000.0,2026-10-05 15:16:00.268808,2026-10-05 15:16:42.076512,0 days 00:00:41.807704,all,20.0,12,50,stratified,0.9,1875,119986875000.0,20,63993,0,COMPLETE
39,0.951280787165618,25268051250.0,2026-10-05 15:16:42.077887,2026-10-05 15:16:53.715761,0 days 00:00:11.637874,uncorrelated,,2,75,reference_balanced,0.1,1215,25268051250.0,39,7110,0,COMPLETE
