number,values_0,values_1,datetime_start,datetime_complete,duration,params_feature_strategy,params_max_input_features,params_minLeafPopulation,params_numberOfTrees,params_sampling_strategy,params_train_fraction,user_attrs_max_nodes,user_attrs_model_complexity,user_attrs_num_features,user_attrs_samples_per_year,system_attrs_NSGAIISampler:generation,state
0,0.9726012808866061,1388955282750.0,2026-10-05 08:46:35.465937,2026-10-05 08:57:53.625731,0 days 00:11:18.159794,all,87.0,7,150,stratified,0.7000000000000001,2309,1388955282750.0,87,46095,0,COMPLETE
1,0.9666591979657677,258015829500.0,2026-10-05 08:57:53.628870,2026-10-05 09:00:42.257568,0 days 00:02:48.628698,uncorrelated,,8,75,reference_balanced,0.9,2245,258015829500.0,38,40326,0,COMPLETE
2,0.9540357979519929,103303251750.0,2026-10-05 09:00:42.260422,2026-10-05 09:02:53.985167,0 days 00:02:11.724745,uncorrelated,,10,125,stratified,0.30000000000000004,1101,103303251750.0,38,19753,0,COMPLETE
3,0.8672281125878554,8764305750.0,2026-10-05 09:02:53.988641,2026-10-05 09:03:28.766677,0 days 00:00:34.778036,uncorrelated,,11,75,reference_balanced,0.1,467,8764305750.0,38,6585,0,COMPLETE
4,0.9204472193958386,21713708250.0,2026-10-05 09:03:28.771515,2026-10-05 09:04:07.922688,0 days 00:00:39.151173,uncorrelated,,2,75,reference_balanced,0.1,1157,21713708250.0,38,6585,0,COMPLETE
5,0.9736375155975416,275611602200.0,2026-10-05 09:04:07.925818,2026-10-05 09:07:10.185780,0 days 00:03:02.259962,uncorrelated,,6,100,stratified,0.5,2203,275611602200.0,38,32923,0,COMPLETE
6,0.8878853825268717,22633303500.0,2026-10-05 09:07:10.189222,2026-10-05 09:08:15.301485,0 days 00:01:05.112263,uncorrelated,,7,150,reference_balanced,0.1,603,22633303500.0,38,6585,0,COMPLETE
7,0.9445856642346736,261852031875.0,2026-10-05 09:08:15.305581,2026-10-05 09:10:55.201849,0 days 00:02:39.896268,all,101.0,3,75,reference_balanced,0.30000000000000004,1855,261852031875.0,101,18635,0,COMPLETE
8,0.9637640403959079,158837351400.0,2026-10-05 09:10:55.206807,2026-10-05 09:12:30.507622,0 days 00:01:35.300815,uncorrelated,,3,50,reference_balanced,0.5,2853,158837351400.0,38,29302,0,COMPLETE
9,0.9691927798333061,500368277500.0,2026-10-05 09:12:30.512017,2026-10-05 09:16:04.748167,0 days 00:03:34.236150,uncorrelated,,2,125,reference_balanced,0.5,3595,500368277500.0,38,29302,0,COMPLETE
10,0.974131256226044,935825319000.0,2026-10-05 09:16:04.751228,2026-10-05 09:23:45.042350,0 days 00:07:40.291122,all,54.0,4,150,reference_balanced,0.9,2865,935825319000.0,54,40326,0,COMPLETE
11,0.8752655253116768,9702668250.0,2026-10-05 09:23:45.047872,2026-10-05 09:24:21.307741,0 days 00:00:36.259869,uncorrelated,,9,75,reference_balanced,0.1,517,9702668250.0,38,6585,0,COMPLETE
12,0.9819867831072764,1030810187550.0,2026-10-05 09:24:21.311674,2026-10-05 09:29:45.834582,0 days 00:05:24.522908,all,83.0,3,50,stratified,0.9,4191,1030810187550.0,83,59267,0,COMPLETE
13,0.9538691690287968,82642601400.0,2026-10-05 09:29:45.837376,2026-10-05 09:31:31.747884,0 days 00:01:45.910508,uncorrelated,,10,100,stratified,0.30000000000000004,1101,82642601400.0,38,19753,0,COMPLETE
14,0.9655967217548558,689175564000.0,2026-10-05 09:31:31.750977,2026-10-05 09:39:17.503573,0 days 00:07:45.752596,all,88.0,12,100,stratified,0.7000000000000001,1699,689175564000.0,88,46095,0,COMPLETE
15,0.970067184933762,299174247000.0,2026-10-05 09:39:17.507823,2026-10-05 09:42:30.387043,0 days 00:03:12.879220,uncorrelated,,4,75,reference_balanced,0.7000000000000001,2955,299174247000.0,38,35524,0,COMPLETE
16,0.9510288027798635,57478267050.0,2026-10-05 09:42:30.392814,2026-10-05 09:44:04.908632,0 days 00:01:34.515818,uncorrelated,,11,75,stratified,0.30000000000000004,1021,57478267050.0,38,19753,0,COMPLETE
17,0.976920733859573,718153055750.0,2026-10-05 09:44:04.911422,2026-10-05 09:52:05.950357,0 days 00:08:01.038935,uncorrelated,,10,125,stratified,0.9,2551,718153055750.0,38,59267,0,COMPLETE
18,0.9787783049044385,753624355250.0,2026-10-05 09:52:05.953507,2026-10-05 09:59:27.871180,0 days 00:07:21.917673,uncorrelated,,9,125,stratified,0.9,2677,753624355250.0,38,59267,0,COMPLETE
19,0.984385471687147,295936814250.0,2026-10-05 09:59:27.873802,2026-10-05 10:01:33.692571,0 days 00:02:05.818769,all,33.0,2,50,stratified,0.7000000000000001,3891,295936814250.0,33,46095,0,COMPLETE
20,0.8910883964770586,17816540625.0,2026-10-05 10:01:33.696145,2026-10-05 10:02:27.279914,0 days 00:00:53.583769,all,39.0,7,125,reference_balanced,0.1,555,17816540625.0,39,6585,0,COMPLETE
21,0.9551115623573252,392785321500.0,2026-10-05 10:02:27.285995,2026-10-05 10:06:51.651002,0 days 00:04:24.365007,all,78.0,11,75,reference_balanced,0.9,1665,392785321500.0,78,40326,0,COMPLETE
22,0.9132538204715217,17440290000.0,2026-10-05 10:06:51.653326,2026-10-05 10:07:53.388786,0 days 00:01:01.735460,uncorrelated,,10,150,stratified,0.1,465,17440290000.0,38,6580,0,COMPLETE
23,0.9679998601445179,577378881750.0,2026-10-05 10:07:53.390950,2026-10-05 11:06:27.116854,0 days 00:58:33.725904,all,67.0,7,150,stratified,0.5,1745,577378881750.0,67,32923,0,COMPLETE
24,0.9815143059392737,472540587750.0,2026-10-05 11:06:27.121406,2026-10-05 11:11:30.945684,0 days 00:05:03.824278,uncorrelated,,4,75,stratified,0.7000000000000001,3597,472540587750.0,38,46095,0,COMPLETE
25,0.8736781202508587,17903956500.0,2026-10-05 11:11:30.955175,2026-10-05 11:13:36.944342,0 days 00:02:05.989167,uncorrelated,,10,150,reference_balanced,0.1,477,17903956500.0,38,6585,0,COMPLETE
26,0.8734601561163526,14919963750.0,2026-10-05 11:13:36.949196,2026-10-05 11:15:14.456832,0 days 00:01:37.507636,uncorrelated,,10,125,reference_balanced,0.1,477,14919963750.0,38,6585,0,COMPLETE
27,0.9803207482832049,828949432500.0,2026-10-05 11:15:14.459728,2026-10-05 11:26:31.635794,0 days 00:11:17.176066,uncorrelated,,5,150,stratified,0.7000000000000001,3155,828949432500.0,38,46095,0,COMPLETE
28,0.9815623723701321,1641414381750.0,2026-10-05 11:26:31.640781,2026-10-05 11:45:07.963537,0 days 00:18:36.322756,all,55.0,5,150,stratified,0.9,3357,1641414381750.0,55,59267,0,COMPLETE
29,0.9635582890283951,164254095000.0,2026-10-05 11:45:07.967146,2026-10-05 11:48:22.136216,0 days 00:03:14.169070,all,45.0,6,50,reference_balanced,0.7000000000000001,2055,164254095000.0,45,35524,0,COMPLETE
30,0.9042928557764448,17899245000.0,2026-10-05 11:48:22.141656,2026-10-05 11:49:37.854716,0 days 00:01:15.713060,all,90.0,10,75,stratified,0.1,403,17899245000.0,90,6580,0,COMPLETE
31,0.9758851464337468,274198775500.0,2026-10-05 11:49:37.860272,2026-10-05 11:53:58.784493,0 days 00:04:20.924221,uncorrelated,,10,50,stratified,0.9,2435,274198775500.0,38,59267,0,COMPLETE
32,0.9743813308057927,225548888400.0,2026-10-05 11:53:58.788036,2026-10-05 11:59:42.794970,0 days 00:05:44.006934,all,24.0,6,150,stratified,0.5,1903,225548888400.0,24,32923,0,COMPLETE
33,0.9727806492708877,214606796250.0,2026-10-05 11:59:42.810386,2026-10-05 12:05:47.871599,0 days 00:06:05.061213,all,22.0,11,125,stratified,0.7000000000000001,1693,214606796250.0,22,46095,0,COMPLETE
34,0.9838637772266892,1062168357250.0,2026-10-05 12:05:47.873325,2026-10-05 12:08:22.467521,0 days 00:02:34.594196,uncorrelated,,5,125,stratified,0.9,3773,1062168357250.0,38,59267,0,COMPLETE
35,0.9036863829395692,9993375000.0,2026-10-05 12:08:22.468994,2026-10-05 12:08:34.810145,0 days 00:00:12.341151,all,75.0,10,50,stratified,0.1,405,9993375000.0,75,6580,0,COMPLETE
36,0.9631313740211886,446888367600.0,2026-10-05 12:08:34.812086,2026-10-05 12:10:18.748449,0 days 00:01:43.936363,uncorrelated,,7,150,reference_balanced,0.7000000000000001,2207,446888367600.0,38,35524,0,COMPLETE
37,0.9588314346551068,140903076600.0,2026-10-05 12:10:18.750423,2026-10-05 12:10:58.447690,0 days 00:00:39.697267,uncorrelated,,12,50,reference_balanced,0.9,1839,140903076600.0,38,40326,0,COMPLETE
38,0.9773139716414222,554345391600.0,2026-10-05 12:10:58.449090,2026-10-05 12:12:35.408811,0 days 00:01:36.959721,all,42.0,3,100,reference_balanced,0.9,3273,554345391600.0,42,40326,0,COMPLETE
39,0.9314388066467387,12761730000.0,2026-10-05 12:12:35.411110,2026-10-05 12:12:53.058452,0 days 00:00:17.647342,all,16.0,2,125,reference_balanced,0.1,969,12761730000.0,16,6585,0,COMPLETE
