number,values_0,values_1,datetime_start,datetime_complete,duration,params_feature_strategy,params_max_input_features,params_minLeafPopulation,params_numberOfTrees,params_sampling_strategy,params_train_fraction,user_attrs_max_nodes,user_attrs_model_complexity,user_attrs_num_features,user_attrs_samples_per_year,system_attrs_NSGAIISampler:generation,state
0,0.9172540891708889,59233194000.0,2026-10-05 19:30:56.244084,2026-10-05 19:31:20.376718,0 days 00:00:24.132634,all,81.0,7,100,reference_balanced,0.1,921,59233194000.0,81,7940,0,COMPLETE
1,0.968118963146055,1945032942600.0,2026-10-05 19:31:20.378099,2026-10-05 19:34:08.177622,0 days 00:02:47.799523,all,88.0,11,75,stratified,0.9,4101,1945032942600.0,88,71861,0,COMPLETE
2,0.9760759800371668,856961370000.0,2026-10-05 19:34:08.179185,2026-10-05 19:35:51.068117,0 days 00:01:42.888932,uncorrelated,,8,100,stratified,0.7000000000000001,4035,856961370000.0,38,55890,0,COMPLETE
3,0.9757775488389681,480586932000.0,2026-10-05 19:35:51.069319,2026-10-05 19:37:28.132968,0 days 00:01:37.063649,all,28.0,11,100,stratified,0.7000000000000001,3071,480586932000.0,28,55890,0,COMPLETE
4,0.9702780490626532,845310142500.0,2026-10-05 19:37:28.134373,2026-10-05 19:39:32.866294,0 days 00:02:04.731921,uncorrelated,,11,150,reference_balanced,0.7000000000000001,3065,845310142500.0,38,48385,0,COMPLETE
5,0.9783932481833872,1509717447000.0,2026-10-05 19:39:32.868009,2026-10-05 19:42:07.913799,0 days 00:02:35.045790,uncorrelated,,6,150,stratified,0.7000000000000001,4739,1509717447000.0,38,55890,0,COMPLETE
6,0.975175333293306,391950981000.0,2026-10-05 19:42:07.915488,2026-10-05 19:43:01.209594,0 days 00:00:53.294106,uncorrelated,,9,50,stratified,0.7000000000000001,3691,391950981000.0,38,55890,0,COMPLETE
7,0.9414411167027602,54724465000.0,2026-10-05 19:43:01.211177,2026-10-05 19:43:22.099207,0 days 00:00:20.888030,uncorrelated,,4,125,reference_balanced,0.1,1451,54724465000.0,38,7940,0,COMPLETE
8,0.9842496670255032,2765875994250.0,2026-10-05 19:43:22.100656,2026-10-05 19:46:16.739479,0 days 00:02:54.638823,uncorrelated,,3,125,stratified,0.9,8103,2765875994250.0,38,71861,0,COMPLETE
9,0.9602254476722496,1109997281250.0,2026-10-05 19:46:16.741089,2026-10-05 19:48:09.979192,0 days 00:01:53.238103,all,78.0,8,125,reference_balanced,0.5,3025,1109997281250.0,78,37635,0,COMPLETE
10,0.975933135959121,4533070284000.0,2026-10-05 19:48:09.980842,2026-10-05 19:51:29.213122,0 days 00:03:19.232280,all,101.0,2,100,reference_balanced,0.9,7841,4533070284000.0,101,57240,0,COMPLETE
11,0.9738413052753663,1032754131000.0,2026-10-05 19:51:29.214402,2026-10-05 19:53:10.159754,0 days 00:01:40.945352,all,53.0,6,75,reference_balanced,0.9,4539,1032754131000.0,53,57240,0,COMPLETE
12,0.8519519067208086,32793690000.0,2026-10-05 19:53:10.161236,2026-10-05 19:53:28.163235,0 days 00:00:18.001999,all,60.0,12,100,stratified,0.1,685,32793690000.0,60,7979,0,COMPLETE
13,0.9767351962790094,874636291000.0,2026-10-05 19:53:28.164565,2026-10-05 19:54:53.782167,0 days 00:01:25.617602,uncorrelated,,5,100,reference_balanced,0.7000000000000001,4757,874636291000.0,38,48385,0,COMPLETE
14,0.9143423180054979,26362785000.0,2026-10-05 19:54:53.783395,2026-10-05 19:55:12.197803,0 days 00:00:18.414408,uncorrelated,,12,125,reference_balanced,0.1,699,26362785000.0,38,7940,0,COMPLETE
15,0.9815681598530885,541005538500.0,2026-10-05 19:55:12.199047,2026-10-05 19:57:02.076179,0 days 00:01:49.877132,all,14.0,11,150,stratified,0.9,3585,541005538500.0,14,71861,0,COMPLETE
16,0.879328523364088,30130698750.0,2026-10-05 19:57:02.077396,2026-10-05 19:57:20.957665,0 days 00:00:18.880269,uncorrelated,,10,125,stratified,0.1,795,30130698750.0,38,7979,0,COMPLETE
17,0.9832787656310842,251329392000.0,2026-10-05 19:57:20.958921,2026-10-05 19:58:21.184480,0 days 00:01:00.225559,all,12.0,6,100,reference_balanced,0.9,3659,251329392000.0,12,57240,0,COMPLETE
18,0.8718500188130776,75406337400.0,2026-10-05 19:58:21.185569,2026-10-05 19:58:49.991735,0 days 00:00:28.806166,all,76.0,9,150,stratified,0.1,829,75406337400.0,76,7979,0,COMPLETE
19,0.9752442907244798,6822846238050.0,2026-10-05 19:58:49.993069,2026-10-05 20:04:55.897797,0 days 00:06:05.904728,all,101.0,5,150,stratified,0.9,6267,6822846238050.0,101,71861,0,COMPLETE
20,0.9755345376452369,685325934000.0,2026-10-05 20:04:55.899181,2026-10-05 20:06:12.140871,0 days 00:01:16.241690,uncorrelated,,8,75,reference_balanced,0.9,4201,685325934000.0,38,57240,0,COMPLETE
21,0.976929778055796,1695366270300.0,2026-10-05 20:06:12.142760,2026-10-05 20:09:19.126384,0 days 00:03:06.983624,uncorrelated,,11,150,stratified,0.9,4139,1695366270300.0,38,71861,0,COMPLETE
22,0.9556471730523868,19403332200.0,2026-10-05 20:09:19.127530,2026-10-05 20:09:36.253729,0 days 00:00:17.126199,all,12.0,3,150,stratified,0.1,1351,19403332200.0,12,7979,0,COMPLETE
23,0.9800468002206346,1623602221500.0,2026-10-05 20:09:36.255179,2026-10-05 20:11:45.691076,0 days 00:02:09.435897,uncorrelated,,3,150,reference_balanced,0.7000000000000001,5887,1623602221500.0,38,48385,0,COMPLETE
24,0.9767861431974241,523007604000.0,2026-10-05 20:11:45.692366,2026-10-05 20:12:39.269479,0 days 00:00:53.577113,uncorrelated,,6,50,reference_balanced,0.9,4809,523007604000.0,38,57240,0,COMPLETE
25,0.9741447538919781,304546183500.0,2026-10-05 20:12:39.270649,2026-10-05 20:13:14.748382,0 days 00:00:35.477733,uncorrelated,,4,50,reference_balanced,0.5,4259,304546183500.0,38,37635,0,COMPLETE
26,0.9268184163076341,41089897000.0,2026-10-05 20:13:14.749547,2026-10-05 20:13:28.565988,0 days 00:00:13.816441,all,83.0,4,50,reference_balanced,0.1,1247,41089897000.0,83,7940,0,COMPLETE
27,0.9384768917882859,58366385000.0,2026-10-05 20:13:28.567194,2026-10-05 20:13:46.084380,0 days 00:00:17.517186,uncorrelated,,2,100,stratified,0.1,1925,58366385000.0,38,7979,0,COMPLETE
28,0.9803298614064525,1793057706750.0,2026-10-05 20:13:46.085526,2026-10-05 20:16:28.456072,0 days 00:02:42.370546,uncorrelated,,7,125,stratified,0.9,5253,1793057706750.0,38,71861,0,COMPLETE
29,0.975830191938375,960407170875.0,2026-10-05 20:16:28.457264,2026-10-05 20:17:44.634215,0 days 00:01:16.176951,all,47.0,3,75,reference_balanced,0.7000000000000001,5631,960407170875.0,47,48385,0,COMPLETE
30,0.9804996339153806,1040608361850.0,2026-10-05 20:17:44.635561,2026-10-05 20:19:24.388223,0 days 00:01:39.752662,uncorrelated,,7,75,stratified,0.9,5081,1040608361850.0,38,71861,0,COMPLETE
31,0.9736137844701754,749496078000.0,2026-10-05 20:19:24.389757,2026-10-05 20:21:01.701365,0 days 00:01:37.311608,uncorrelated,,10,100,stratified,0.7000000000000001,3529,749496078000.0,38,55890,0,COMPLETE
32,0.9822600980891969,924757650700.0,2026-10-05 20:21:01.702564,2026-10-05 20:22:11.317468,0 days 00:01:09.614904,uncorrelated,,4,50,stratified,0.9,6773,924757650700.0,38,71861,0,COMPLETE
33,0.9564916618484707,80050956750.0,2026-10-05 20:22:11.318630,2026-10-05 20:22:46.166495,0 days 00:00:34.847865,all,15.0,12,150,reference_balanced,0.30000000000000004,1501,80050956750.0,15,23703,0,COMPLETE
34,0.9816317179716483,507260880000.0,2026-10-05 20:22:46.167811,2026-10-05 20:24:03.305284,0 days 00:01:17.137473,all,20.0,5,100,reference_balanced,0.9,4431,507260880000.0,20,57240,0,COMPLETE
35,0.9189629990743579,9968164700.0,2026-10-05 20:24:03.306537,2026-10-05 20:24:13.257800,0 days 00:00:09.951263,all,26.0,6,50,stratified,0.1,961,9968164700.0,26,7979,0,COMPLETE
36,0.9648973567966975,184894066350.0,2026-10-05 20:24:13.259045,2026-10-05 20:24:45.230748,0 days 00:00:31.971703,uncorrelated,,5,75,reference_balanced,0.30000000000000004,2737,184894066350.0,38,23703,0,COMPLETE
37,0.9521571369194238,88325205000.0,2026-10-05 20:24:45.232207,2026-10-05 20:25:07.727264,0 days 00:00:22.495057,uncorrelated,,9,50,stratified,0.30000000000000004,1941,88325205000.0,38,23950,0,COMPLETE
38,0.9770499528188079,982133269625.0,2026-10-05 20:25:07.728510,2026-10-05 20:27:38.116456,0 days 00:02:30.387946,all,31.0,12,125,stratified,0.9,3527,982133269625.0,31,71861,0,COMPLETE
39,0.9720746086927862,3100029644250.0,2026-10-05 20:27:38.117668,2026-10-05 20:31:43.985819,0 days 00:04:05.868151,all,63.0,9,150,stratified,0.9,4565,3100029644250.0,63,71861,0,COMPLETE
