number,values_0,values_1,datetime_start,datetime_complete,duration,params_feature_strategy,params_max_input_features,params_minLeafPopulation,params_numberOfTrees,params_sampling_strategy,params_train_fraction,user_attrs_max_nodes,user_attrs_model_complexity,user_attrs_num_features,user_attrs_samples_per_year,system_attrs_NSGAIISampler:generation,state
0,0.6593774129033931,10757396000.0,2026-10-05 20:32:21.994745,2026-10-05 20:32:33.209623,0 days 00:00:11.214878,uncorrelated,,6,125,reference_balanced,0.1,559,10757396000.0,34,4528,0,COMPLETE
1,0.7663243033794263,143909581500.0,2026-10-05 20:32:33.210791,2026-10-05 20:33:23.554275,0 days 00:00:50.343484,all,38.0,7,125,reference_balanced,0.5,1539,143909581500.0,38,19686,0,COMPLETE
2,0.7235256638223183,31242175000.0,2026-10-05 20:33:23.555816,2026-10-05 20:33:35.015736,0 days 00:00:11.459920,uncorrelated,,6,50,reference_balanced,0.30000000000000004,1387,31242175000.0,34,13250,0,COMPLETE
3,0.7073900297878831,52403750000.0,2026-10-05 20:33:35.017095,2026-10-05 20:34:06.799929,0 days 00:00:31.782834,all,40.0,12,125,reference_balanced,0.30000000000000004,791,52403750000.0,40,13250,0,COMPLETE
4,0.7947144045758261,261381209250.0,2026-10-05 20:34:06.801299,2026-10-05 20:34:53.059358,0 days 00:00:46.258059,uncorrelated,,7,125,reference_balanced,0.9,2261,261381209250.0,34,27201,0,COMPLETE
5,0.9320218165847154,229773892950.0,2026-10-05 20:34:53.060766,2026-10-05 20:35:18.371570,0 days 00:00:25.310804,uncorrelated,,2,75,stratified,0.5,3983,229773892950.0,34,22623,0,COMPLETE
6,0.8688557295116832,24285550500.0,2026-10-05 20:35:18.373151,2026-10-05 20:35:32.977908,0 days 00:00:14.604757,all,41.0,10,50,stratified,0.30000000000000004,873,24285550500.0,41,13570,0,COMPLETE
7,0.6313492491618693,6133176000.0,2026-10-05 20:35:32.979116,2026-10-05 20:35:43.560332,0 days 00:00:10.581216,all,43.0,12,100,reference_balanced,0.1,315,6133176000.0,43,4528,0,COMPLETE
8,0.7795880644513139,7516000800.0,2026-10-05 20:35:43.561545,2026-10-05 20:35:54.676214,0 days 00:00:11.114669,all,56.0,12,100,stratified,0.1,297,7516000800.0,56,4519,0,COMPLETE
9,0.9073348010499941,124168892500.0,2026-10-05 20:35:54.677535,2026-10-05 20:36:19.015374,0 days 00:00:24.337839,uncorrelated,,3,125,stratified,0.30000000000000004,2153,124168892500.0,34,13570,0,COMPLETE
10,0.92418111501414,284510640000.0,2026-10-05 20:36:19.016644,2026-10-05 20:37:30.708250,0 days 00:01:11.691606,all,30.0,9,100,stratified,0.9,2329,284510640000.0,30,40720,0,COMPLETE
11,0.6547333353720193,3347890000.0,2026-10-05 20:37:30.709510,2026-10-05 20:37:40.358214,0 days 00:00:09.648704,all,13.0,8,125,reference_balanced,0.1,455,3347890000.0,13,4528,0,COMPLETE
12,0.7150086740992989,51131750000.0,2026-10-05 20:37:40.359465,2026-10-05 20:37:59.492414,0 days 00:00:19.132949,uncorrelated,,8,100,reference_balanced,0.30000000000000004,1135,51131750000.0,34,13250,0,COMPLETE
13,0.8893093222534004,73437651450.0,2026-10-05 20:37:59.493670,2026-10-05 20:38:21.405759,0 days 00:00:21.912089,uncorrelated,,12,75,stratified,0.5,1273,73437651450.0,34,22623,0,COMPLETE
14,0.8533748985935001,12452104500.0,2026-10-05 20:38:21.406977,2026-10-05 20:38:34.748641,0 days 00:00:13.341664,all,22.0,3,150,stratified,0.1,835,12452104500.0,22,4519,0,COMPLETE
15,0.7111843032806657,20153250000.0,2026-10-05 20:38:34.750222,2026-10-05 20:38:55.240727,0 days 00:00:20.490505,all,12.0,11,150,reference_balanced,0.30000000000000004,845,20153250000.0,12,13250,0,COMPLETE
16,0.6305051032806779,5650038400.0,2026-10-05 20:38:55.242037,2026-10-05 20:39:04.337034,0 days 00:00:09.094997,uncorrelated,,11,100,reference_balanced,0.1,367,5650038400.0,34,4528,0,COMPLETE
17,0.9261141986951449,111397704000.0,2026-10-05 20:39:04.338403,2026-10-05 20:39:34.169237,0 days 00:00:29.830834,all,22.0,8,50,stratified,0.9,2487,111397704000.0,22,40720,0,COMPLETE
18,0.8527053423785849,13505483400.0,2026-10-05 20:39:34.170550,2026-10-05 20:39:43.761122,0 days 00:00:09.590572,uncorrelated,,3,100,stratified,0.1,879,13505483400.0,34,4519,0,COMPLETE
19,0.8999672158131593,625185473850.0,2026-10-05 20:39:43.762344,2026-10-05 20:41:15.173781,0 days 00:01:31.411437,all,93.0,6,150,stratified,0.5,1981,625185473850.0,93,22623,0,COMPLETE
20,0.9178054122952503,468715704000.0,2026-10-05 20:41:15.175272,2026-10-05 20:42:32.525627,0 days 00:01:17.350355,uncorrelated,,11,150,stratified,0.9,2257,468715704000.0,34,40720,0,COMPLETE
21,0.6754881149921408,8555882400.0,2026-10-05 20:42:32.526883,2026-10-05 20:42:40.382433,0 days 00:00:07.855550,uncorrelated,,4,75,reference_balanced,0.1,741,8555882400.0,34,4528,0,COMPLETE
22,0.7609481345559566,93667964250.0,2026-10-05 20:42:40.383572,2026-10-05 20:43:05.759141,0 days 00:00:25.375569,uncorrelated,,11,75,reference_balanced,0.7000000000000001,1505,93667964250.0,34,24407,0,COMPLETE
23,0.9223108544396226,146598967900.0,2026-10-05 20:43:05.760379,2026-10-05 20:43:28.886894,0 days 00:00:23.126515,uncorrelated,,6,50,stratified,0.7000000000000001,2723,146598967900.0,34,31669,0,COMPLETE
24,0.9076078078942931,762127152600.0,2026-10-05 20:43:28.888146,2026-10-05 20:45:21.143118,0 days 00:01:52.254972,all,76.0,8,150,stratified,0.7000000000000001,2111,762127152600.0,76,31669,0,COMPLETE
25,0.9409440634276818,926840136000.0,2026-10-05 20:45:21.144342,2026-10-05 20:46:45.930175,0 days 00:01:24.785833,uncorrelated,,4,150,stratified,0.9,4463,926840136000.0,34,40720,0,COMPLETE
26,0.7754935929372502,135678513000.0,2026-10-05 20:46:45.931405,2026-10-05 20:47:29.135993,0 days 00:00:43.204588,all,34.0,9,100,reference_balanced,0.7000000000000001,1635,135678513000.0,34,24407,0,COMPLETE
27,0.7919564438769595,103350199500.0,2026-10-05 20:47:29.137136,2026-10-05 20:47:49.476731,0 days 00:00:20.339595,uncorrelated,,7,50,reference_balanced,0.9,2235,103350199500.0,34,27201,0,COMPLETE
28,0.9195312631087842,344609390400.0,2026-10-05 20:47:49.478302,2026-10-05 20:49:10.497434,0 days 00:01:21.019132,all,32.0,7,150,stratified,0.7000000000000001,2267,344609390400.0,32,31669,0,COMPLETE
29,0.7979552874302438,8242994925.0,2026-10-05 20:49:10.498753,2026-10-05 20:49:20.179574,0 days 00:00:09.680821,all,67.0,9,75,stratified,0.1,363,8242994925.0,67,4519,0,COMPLETE
30,0.7327505853849109,100816927500.0,2026-10-05 20:49:20.180962,2026-10-05 20:49:52.027562,0 days 00:00:31.846600,uncorrelated,,12,125,reference_balanced,0.5,1205,100816927500.0,34,19686,0,COMPLETE
31,0.7877236570483445,95282487300.0,2026-10-05 20:49:52.028831,2026-10-05 20:50:25.414011,0 days 00:00:33.385180,all,28.0,7,75,reference_balanced,0.7000000000000001,1859,95282487300.0,28,24407,0,COMPLETE
32,0.785436162025194,53974860150.0,2026-10-05 20:50:25.415445,2026-10-05 20:50:44.620957,0 days 00:00:19.205512,all,23.0,7,50,reference_balanced,0.7000000000000001,1923,53974860150.0,23,24407,0,COMPLETE
33,0.7859072390680376,112544817525.0,2026-10-05 20:50:44.622209,2026-10-05 20:51:25.605266,0 days 00:00:40.983057,all,37.0,11,75,reference_balanced,0.9,1491,112544817525.0,37,27201,0,COMPLETE
34,0.6956559754515643,38067250000.0,2026-10-05 20:51:25.606748,2026-10-05 20:51:43.813268,0 days 00:00:18.206520,uncorrelated,,12,100,reference_balanced,0.30000000000000004,845,38067250000.0,34,13250,0,COMPLETE
35,0.6935160451745634,16676058000.0,2026-10-05 20:51:43.814866,2026-10-05 20:51:54.128386,0 days 00:00:10.313520,all,61.0,3,75,reference_balanced,0.1,805,16676058000.0,61,4528,0,COMPLETE
36,0.7676058684135618,297928926900.0,2026-10-05 20:51:54.129543,2026-10-05 20:53:11.605399,0 days 00:01:17.475856,all,54.0,10,150,reference_balanced,0.7000000000000001,1507,297928926900.0,54,24407,0,COMPLETE
37,0.8278088588160885,8465894600.0,2026-10-05 20:53:11.606500,2026-10-05 20:53:20.809739,0 days 00:00:09.203239,uncorrelated,,6,100,stratified,0.1,551,8465894600.0,34,4519,0,COMPLETE
38,0.9218564920912554,355003068000.0,2026-10-05 20:53:20.811073,2026-10-05 20:54:22.591040,0 days 00:01:01.779967,all,46.0,8,75,stratified,0.9,2527,355003068000.0,46,40720,0,COMPLETE
39,0.7722147037441038,125015704875.0,2026-10-05 20:54:22.592372,2026-10-05 20:55:14.073373,0 days 00:00:51.481001,all,29.0,11,125,reference_balanced,0.7000000000000001,1413,125015704875.0,29,24407,0,COMPLETE
