number,values_0,values_1,datetime_start,datetime_complete,duration,params_feature_strategy,params_max_input_features,params_minLeafPopulation,params_numberOfTrees,params_sampling_strategy,params_train_fraction,user_attrs_max_nodes,user_attrs_model_complexity,user_attrs_num_features,user_attrs_samples_per_year,system_attrs_NSGAIISampler:generation,state
0,0.9101950638691787,523997460000.0,2026-10-05 12:13:46.917110,2026-10-05 12:16:29.306313,0 days 00:02:42.389203,all,70.0,12,150,stratified,0.7000000000000001,1439,523997460000.0,70,34680,0,COMPLETE
1,0.7713941842501477,4845949200.0,2026-10-05 12:16:29.307517,2026-10-05 12:16:38.323928,0 days 00:00:09.016411,uncorrelated,,7,50,reference_balanced,0.1,543,4845949200.0,36,4958,0,COMPLETE
2,0.7622857818015155,25223825000.0,2026-10-05 12:16:38.325466,2026-10-05 12:17:02.043602,0 days 00:00:23.718136,all,100.0,9,125,reference_balanced,0.1,407,25223825000.0,100,4958,0,COMPLETE
3,0.8181620693097079,140014450800.0,2026-10-05 12:17:02.044999,2026-10-05 12:17:38.636657,0 days 00:00:36.591658,uncorrelated,,10,50,reference_balanced,0.9,2163,140014450800.0,36,35962,0,COMPLETE
4,0.8069397991240386,246359195550.0,2026-10-05 12:17:38.637915,2026-10-05 12:18:40.009139,0 days 00:01:01.371224,all,103.0,11,50,reference_balanced,0.7000000000000001,1539,246359195550.0,103,31083,0,COMPLETE
5,0.8318664063109358,397225479000.0,2026-10-05 12:18:40.011614,2026-10-05 12:20:18.221469,0 days 00:01:38.209855,all,69.0,5,125,reference_balanced,0.5,1939,397225479000.0,69,23752,0,COMPLETE
6,0.9236223861858783,259389526500.0,2026-10-05 12:20:18.222781,2026-10-05 12:21:19.810283,0 days 00:01:01.587502,uncorrelated,,5,125,stratified,0.5,2327,259389526500.0,36,24771,0,COMPLETE
7,0.9283024406560458,112227492600.0,2026-10-05 12:21:19.815854,2026-10-05 12:21:45.263471,0 days 00:00:25.447617,uncorrelated,,4,50,stratified,0.5,2517,112227492600.0,36,24771,0,COMPLETE
8,0.8486510229259813,488032344000.0,2026-10-05 12:21:45.264648,2026-10-05 12:23:07.039402,0 days 00:01:21.774754,uncorrelated,,2,150,reference_balanced,0.5,3805,488032344000.0,36,23752,0,COMPLETE
9,0.9618026704837241,61774986000.0,2026-10-05 12:23:07.040530,2026-10-05 12:23:41.073691,0 days 00:00:34.033161,all,12.0,6,50,stratified,0.9,2309,61774986000.0,12,44590,0,COMPLETE
10,0.8485828179818571,701205057000.0,2026-10-05 12:23:41.074754,2026-10-05 12:25:20.679566,0 days 00:01:39.604812,uncorrelated,,3,125,reference_balanced,0.9,4333,701205057000.0,36,35962,0,COMPLETE
11,0.9283059575495743,164986632000.0,2026-10-05 12:25:20.682898,2026-10-05 12:25:56.031883,0 days 00:00:35.348985,uncorrelated,,6,50,stratified,0.7000000000000001,2643,164986632000.0,36,34680,0,COMPLETE
12,0.8109914912509024,536333279625.0,2026-10-05 12:25:56.033356,2026-10-05 12:28:17.959114,0 days 00:02:21.925758,all,89.0,11,125,reference_balanced,0.7000000000000001,1551,536333279625.0,89,31083,0,COMPLETE
13,0.8061664709366709,29502900000.0,2026-10-05 12:28:17.960435,2026-10-05 12:28:34.638636,0 days 00:00:16.678201,uncorrelated,,9,50,reference_balanced,0.30000000000000004,1115,29502900000.0,36,14700,0,COMPLETE
14,0.8855831607992897,165223164600.0,2026-10-05 12:28:34.639706,2026-10-05 12:29:23.785440,0 days 00:00:49.145734,all,106.0,7,100,stratified,0.30000000000000004,1049,165223164600.0,106,14859,0,COMPLETE
15,0.9354033079922234,133451285400.0,2026-10-05 12:29:23.787197,2026-10-05 12:29:50.125067,0 days 00:00:26.337870,uncorrelated,,3,50,stratified,0.5,2993,133451285400.0,36,24771,0,COMPLETE
16,0.8178580624912669,9779227200.0,2026-10-05 12:29:50.126116,2026-10-05 12:30:01.064055,0 days 00:00:10.937939,uncorrelated,,6,100,stratified,0.1,549,9779227200.0,36,4948,0,COMPLETE
17,0.9052184014969629,158621098500.0,2026-10-05 12:30:01.065043,2026-10-05 12:30:35.323111,0 days 00:00:34.258068,all,90.0,8,50,stratified,0.5,1423,158621098500.0,90,24771,0,COMPLETE
18,0.906638547992042,264615336000.0,2026-10-05 12:30:35.324339,2026-10-05 12:31:42.370662,0 days 00:01:07.046323,all,72.0,12,75,stratified,0.7000000000000001,1413,264615336000.0,72,34680,0,COMPLETE
19,0.812385086978424,202424929200.0,2026-10-05 12:31:42.372000,2026-10-05 12:32:33.898994,0 days 00:00:51.526994,uncorrelated,,11,100,reference_balanced,0.7000000000000001,1809,202424929200.0,36,31083,0,COMPLETE
20,0.9271864897232525,74517360750.0,2026-10-05 12:32:33.900308,2026-10-05 12:33:26.760740,0 days 00:00:52.860432,all,18.0,8,125,stratified,0.5,1337,74517360750.0,18,24771,0,COMPLETE
21,0.8396202250074268,139338360000.0,2026-10-05 12:33:26.762355,2026-10-05 12:33:59.241185,0 days 00:00:32.478830,uncorrelated,,2,100,reference_balanced,0.30000000000000004,2633,139338360000.0,36,14700,0,COMPLETE
22,0.8287830828962761,229907484000.0,2026-10-05 12:33:59.242579,2026-10-05 12:35:00.039334,0 days 00:01:00.796755,uncorrelated,,6,125,reference_balanced,0.5,2151,229907484000.0,36,23752,0,COMPLETE
23,0.8314833585850213,800406234000.0,2026-10-05 12:35:00.040859,2026-10-05 12:37:02.778440,0 days 00:02:02.737581,all,90.0,6,100,reference_balanced,0.9,2473,800406234000.0,90,35962,0,COMPLETE
24,0.9312489718641345,118262781000.0,2026-10-05 12:37:02.779555,2026-10-05 12:37:35.697583,0 days 00:00:32.918028,all,42.0,2,100,stratified,0.30000000000000004,1895,118262781000.0,42,14859,0,COMPLETE
25,0.7648048432315395,4763398500.0,2026-10-05 12:37:35.699121,2026-10-05 12:37:49.771886,0 days 00:00:14.072765,all,15.0,9,150,reference_balanced,0.1,427,4763398500.0,15,4958,0,COMPLETE
26,0.9077303377953814,158338476000.0,2026-10-05 12:37:49.773330,2026-10-05 12:38:34.207423,0 days 00:00:44.434093,uncorrelated,,12,75,stratified,0.7000000000000001,1691,158338476000.0,36,34680,0,COMPLETE
27,0.8994061549432508,30010722300.0,2026-10-05 12:38:34.208996,2026-10-05 12:38:50.597812,0 days 00:00:16.388816,all,38.0,6,50,stratified,0.30000000000000004,1063,30010722300.0,38,14859,0,COMPLETE
28,0.9475216606039182,732259530000.0,2026-10-05 12:38:50.598942,2026-10-05 12:40:08.629656,0 days 00:01:18.030714,all,94.0,3,75,stratified,0.7000000000000001,2995,732259530000.0,94,34680,0,COMPLETE
29,0.8344238262361279,306936000000.0,2026-10-05 12:40:08.630998,2026-10-05 12:40:54.691547,0 days 00:00:46.060549,all,96.0,2,100,reference_balanced,0.30000000000000004,2175,306936000000.0,96,14700,0,COMPLETE
30,0.8287193584746884,132685797600.0,2026-10-05 12:40:54.693658,2026-10-05 12:41:25.291451,0 days 00:00:30.597793,uncorrelated,,6,75,reference_balanced,0.5,2069,132685797600.0,36,23752,0,COMPLETE
31,0.8243391971905659,8029119600.0,2026-10-05 12:41:25.293047,2026-10-05 12:41:34.581498,0 days 00:00:09.288451,uncorrelated,,5,75,stratified,0.1,601,8029119600.0,36,4948,0,COMPLETE
32,0.9626959543846185,1334676798000.0,2026-10-05 12:41:34.582598,2026-10-05 12:43:49.643624,0 days 00:02:15.061026,uncorrelated,,2,150,stratified,0.9,5543,1334676798000.0,36,44590,0,COMPLETE
33,0.8293112396014433,4486599000.0,2026-10-05 12:43:49.644820,2026-10-05 12:43:58.890134,0 days 00:00:09.245314,all,39.0,6,50,stratified,0.1,465,4486599000.0,39,4948,0,COMPLETE
34,0.8459264405201568,425998731600.0,2026-10-05 12:43:58.891822,2026-10-05 12:45:05.765513,0 days 00:01:06.873691,uncorrelated,,3,100,reference_balanced,0.7000000000000001,3807,425998731600.0,36,31083,0,COMPLETE
35,0.8350828972576877,392402959200.0,2026-10-05 12:45:05.766538,2026-10-05 12:46:17.379961,0 days 00:01:11.613423,uncorrelated,,6,100,reference_balanced,0.9,3031,392402959200.0,36,35962,0,COMPLETE
36,0.915532085277887,135268906500.0,2026-10-05 12:46:17.381474,2026-10-05 12:46:55.286034,0 days 00:00:37.904560,uncorrelated,,3,125,stratified,0.30000000000000004,2023,135268906500.0,36,14859,0,COMPLETE
37,0.8084284686407311,31083685200.0,2026-10-05 12:46:55.288776,2026-10-05 12:47:15.392017,0 days 00:00:20.103241,uncorrelated,,2,150,reference_balanced,0.1,1161,31083685200.0,36,4958,0,COMPLETE
38,0.966227871754273,68122791000.0,2026-10-05 12:47:15.394209,2026-10-05 12:47:52.992100,0 days 00:00:37.597891,all,11.0,4,75,stratified,0.7000000000000001,2381,68122791000.0,11,34680,0,COMPLETE
39,0.9496873650317419,163353204000.0,2026-10-05 12:47:52.993421,2026-10-05 12:48:54.776065,0 days 00:01:01.782644,all,21.0,5,100,stratified,0.7000000000000001,2243,163353204000.0,21,34680,0,COMPLETE
